link,title1,title2,genre
https://anime47.com/phim/kage-no-jitsuryokusha-ni-naritakute/m8814.html,Kage no Jitsuryokusha ni Naritakute!,Shadow Garden | Ta Muốn Trở Thành Chúa Tể Bóng Tối,"['hành động', 'hài hước', 'fantasy']"
https://anime47.com/phim/chainsaw-man/m8778.html,Chainsaw Man,Người Cưa,"['hành động', 'phiêu lưu']"
https://anime47.com/phim/tensei-shitara-ken-deshita/m8816.html,Tensei shitara Ken Deshita,"I became the sword by transmigrating, TenKen | Chuyển Sinh Thành Kiếm","['hành động', 'fantasy', 'xuyên không - chuyển kiếp']"
https://anime47.com/phim/noumin-kanren-no-skill-bakka-agetetara-nazeka-tsuyoku-natta/m8836.html,Noumin Kanren no Skill bakka Agetetara Nazeka Tsuyoku Natta.,Tôi Trở Nên Mạnh Hơn Nhờ Nâng Cấp Các Kỹ Năng Của Nông Dân | I Somehow Became Stronger by Raising Farming-Related Skills | 農民関連のスキルばっか上げてたら何故か強くなった。,"['hành động', 'ecchi', 'fantasy']"
https://anime47.com/phim/bleach-sennen-kessen-hen/m8828.html,Bleach: Sennen Kessen-hen,Bleach: Huyết chiến ngàn năm | Bleach: Thousand-Year Blood War Arc | BLEACH 千年血戦篇 | Bleach: Thousand-Year Blood War,"['hành động', 'phiêu lưu', 'fantasy']"
https://anime47.com/phim/cuoc-song-thuong-ngay-cua-tien-vuong-mua-3/m8865.html,Cuộc Sống Thường Ngày Của Tiên Vương Mùa 3,Xian Wang de Richang Shenghuo 3 | The Daily Life of the Immortal King 3,"['hành động', 'hài hước', 'phép thuật', 'học đường', 'super power', 'siêu nhiên']"
https://anime47.com/phim/yuusha-party-wo-tsuihou-sareta-beast-tamer-saikyoushu-no-nekomimi-shoujo-to-deau/m8837.html,"Yuusha Party wo Tsuihou sareta Beast Tamer, Saikyoushu no Nekomimi Shoujo to Deau","Luyện thú sư sau khi bị đuổi khỏi tổ đội của dũng sĩ, gặp được thiếu nữ tai mèo của chủng tộc mạnh nhất | The Beast Tamer Who Got Kicked Out From His Party Meets a Cat Girl From the Superior Race | 勇者パーティーを追放されたビーストテイマー、最強種の猫耳少女と出会う | Beast Tamer","['hành động', 'hài hước', 'fantasy']"
https://anime47.com/phim/vua-hai-tac/m7667.html,Vua Hải Tặc,One Piece | Đảo Hải Tặc,"['hành động', 'hài hước', 'phiêu lưu', 'drama', 'shounen', 'fantasy', 'super power']"
https://anime47.com/phim/renai-flops/m8843.html,Renai Flops,恋愛フロップス | Love Flops,"['hài hước', 'romance', 'học đường']"
https://anime47.com/phim/shinobi-no-ittoki/m8820.html,Shinobi no Ittoki,Shinobi no Ittoki,['hành động']
https://anime47.com/phim/fuufu-ijou-koibito-miman/m8834.html,"Fuufu Ijou, Koibito Miman.","More than a Couple | Less than Lovers. | Fuukoi | 夫婦以上、恋人未満。 | More than a married couple, but not lovers.","['hài hước', 'drama', 'romance', 'học đường']"
https://anime47.com/phim/spy-x-family/m8309.html,Spy x Family,Gia Đình Điệp Viên,"['hành động', 'hài hước', 'kid']"
https://anime47.com/phim/peter-grill-to-kenja-no-jikan-super-extra/m8862.html,Peter Grill to Kenja no Jikan: Super Extra,Peter Grill to Kenja no Jikan 2nd Season | ピーター・グリルと賢者の時間 Super Extra | Peter Grill and the Philosopher's Time: Super Extra,"['hài hước', 'fantasy', 'ecchi', 'harem']"
https://anime47.com/phim/boku-no-hero-academia-6th-season/m8827.html,Boku no Hero Academia 6th Season,My Hero Academia 6 | 僕のヒーローアカデミア 6th Season | My Hero Academia Season 6,"['hành động', 'học đường', 'super power']"
https://anime47.com/phim/blue-lock/m8830.html,Blue Lock,ブルーロック | Blue Lock,['thể thao']
https://anime47.com/phim/futoku-no-guild/m8844.html,Futoku no Guild,Guild of Depravity | 不徳のギルド | Immoral Guild,"['hài hước', 'fantasy', 'ecchi', 'harem']"
https://anime47.com/phim/bocchi-the-rock/m8840.html,Bocchi the Rock!,ぼっち・ざ・ろっく！ | Bocchi the Rock!,"['hài hước', 'đời thường', 'cgdct', 'âm nhạc']"
https://anime47.com/phim/uzaki-chan-wa-asobitai-double/m8817.html,Uzaki-chan wa Asobitai! Double,"Uzaki-chan wa Asobitai! 2nd Season | Uzaki-chan wa Asobitai! ω, Uzaki-chan Wants to Hang Out! 2nd Season, Uzaki-chan Wants to Hang Out! ω | Uzaki-chan Muốn Đi Chơi! Mùa 2","['hài hước', 'ecchi', 'đời thường']"
https://anime47.com/phim/shinmai-renkinjutsushi-no-tenpo-keiei/m8819.html,Shinmai Renkinjutsushi no Tenpo Keiei,Management of Novice Alchemist  | Quản Lý Cửa Hàng Của Nhà Giả Kim Tân Binh,"['phiêu lưu', 'đời thường', 'fantasy']"
https://anime47.com/phim/mairimashita-iruma-kun-3rd-season/m8831.html,Mairimashita! Iruma-kun 3rd Season,Welcome to Demon School! Iruma-kun 3rd Season | 魔入りました！入間くん | Welcome to Demon School! Iruma-kun Season 3,"['hài hước', 'fantasy', 'xuyên không - chuyển kiếp', 'mythology', 'học đường']"
https://anime47.com/phim/mob-psycho-100-iii/m8825.html,Mob Psycho 100 III,Mob Psycho 100 3rd Season | Mob Psycho Hyaku | Mob Psycho One Hundred | モブサイコ100 III | Mob Psycho 100 III,"['hành động', 'hài hước', 'siêu nhiên', 'super power']"
https://anime47.com/phim/bleach/m1300.html,Bleach [Bản HD 1080p],Bleach,"['hành động', 'phiêu lưu', 'fantasy']"
https://anime47.com/phim/nhat-niem-vinh-hang/m7832.html,Nhất Niệm Vĩnh Hằng,Nhất Niệm Vĩnh Hằng,"['phiêu lưu', 'phép thuật', 'siêu nhiên', 'hoạt hình trung quốc']"
https://anime47.com/phim/akuyaku-reijou-nanode-last-boss-wo-kattemimashita/m8815.html,Akuyaku Reijou nanode Last Boss wo Kattemimashita,"I'm the Villainess, So I'm Taming the Final Boss | Nữ phản diện bao nuôi trùm cuối","['hài hước', 'romance', 'fantasy']"
https://anime47.com/phim/fumetsu-no-anata-e-2nd-season/m8829.html,Fumetsu no Anata e 2nd Season,To Your Eternity 2nd Season | To You | the Immortal 2nd Season | 不滅のあなたへ | To Your Eternity Season 2,"['phiêu lưu', 'drama', 'siêu nhiên']"
https://anime47.com/phim/the-gioi-hoan-my/m7975.html,Thế Giới Hoàn Mỹ,,"['hành động', 'viễn tưởng', 'hoạt hình trung quốc']"
https://anime47.com/phim/nhat-ky-thuong-ngay-cua-tien-vuong/m7515.html,Nhật Ký Thường Ngày Của Tiên Vương,Cuộc Sống Thường Ngày Của Tiên Vương,"['hành động', 'hài hước', 'phép thuật', 'học đường', 'super power', 'siêu nhiên']"
https://anime47.com/phim/thon-phe-tinh-khong/m7886.html,Thôn Phệ Tinh Không,Swallowed Star,"['phiêu lưu', 'hoạt hình trung quốc']"
https://anime47.com/phim/dau-pha-thuong-khung-phan-5/m8884.html,Đấu Phá Thương Khung Phần 5,Đấu Phá Thương Khung Phần 5,"['hành động', 'super power', 'siêu nhiên', 'hoạt hình trung quốc']"
https://anime47.com/phim/boruto-naruto-next-generations/m6106.html,Boruto: Naruto Next Generations,BORUTO -NARUTO NEXT GENERATIONS- ( Naruto Season 3) | Boruto: Naruto những thế hệ kế tiếp,"['hành động', 'hài hước', 'shounen', 'super power', 'martial arts']"
https://anime47.com/phim/dau-la-dai-luc/m6678.html,Đấu La Đại Lục,Đấu La Đại Lục,"['hành động', 'phiêu lưu', 'martial arts', 'hoạt hình trung quốc']"
https://anime47.com/phim/overlord-iv/m8667.html,Overlord IV,Overlord IV,"['hành động', 'phiêu lưu', 'phép thuật', 'fantasy', 'game', 'siêu nhiên']"
https://anime47.com/phim/mobile-suit-gundam-the-witch-from-mercury/m8818.html,Mobile Suit Gundam: The Witch from Mercury,"Kidou Senshi Gundam: Suisei no Majo, G-Witch | Mobile Suit Gundam: Pháp sư đến từ Sao Thủy","['học đường', 'fantasy']"
https://anime47.com/phim/cuoc-song-thuong-ngay-cua-tien-vuong-phan-2/m8198.html,Cuộc Sống Thường Ngày Của Tiên Vương Phần 2,Nhật Ký Thường Ngày Của Tiên Vương Phần 2,"['hành động', 'hài hước', 'phép thuật', 'học đường', 'super power', 'siêu nhiên']"
https://anime47.com/phim/spy-x-family-part-2/m8826.html,Spy x Family Part 2,SPY×FAMILY,"['hành động', 'hài hước', 'kid']"
https://anime47.com/phim/akiba-maid-sensou/m8849.html,Akiba Maid Sensou,アキバ冥途戦争 | Akiba Maid War,['đang cập nhật']
https://anime47.com/phim/pokemon-2019/m7433.html,Pokemon (2019),Pocket Monsters,"['hành động', 'hài hước', 'phiêu lưu', 'fantasy', 'kid']"
https://anime47.com/phim/urusei-yatsura-2022/m8821.html,Urusei Yatsura (2022),Urusei Yatsura (2022),"['hài hước', 'romance', 'viễn tưởng']"
https://anime47.com/phim/peter-grill-to-kenja-no-jikan/m7657.html,Peter Grill to Kenja no Jikan,Peter Grill and the Philosopher's Time,"['hài hước', 'fantasy', 'ecchi', 'harem']"
https://anime47.com/phim/naruto-shippuuden/m4742.html,Naruto Shippuuden,Naruto Shippuuden,"['hành động', 'hài hước', 'shounen', 'super power', 'martial arts']"
https://anime47.com/phim/isekai-meikyuu-de-harem-wo/m8676.html,Isekai Meikyuu de Harem wo,A Harem in a Fantasy World Labyrinth | Lập Harem Chốn Mê Cung Ở Dị Giới,"['hành động', 'ecchi', 'phiêu lưu', 'romance', 'fantasy', 'xuyên không - chuyển kiếp']"
https://anime47.com/phim/koukyuu-no-karasu/m8838.html,Koukyuu no Karasu,Kokyu no Karasu | 後宮の烏 | Raven of the Inner Palace,"['fantasy', 'lịch sử']"
https://anime47.com/phim/berserk-ougon-jidai-hen-memorial-edition/m8851.html,Berserk: Ougon Jidai-hen - Memorial Edition,Berserk: The Golden Age Arc - Memorial Edition | ベルセルク 黄金時代篇　MEMORIAL EDITION | Berserk: Thời kỳ Hoàng Kim,"['hành động', 'drama', 'fantasy', 'kinh dị', 'siêu nhiên', 'máu me', 'military', 'mythology']"
https://anime47.com/phim/showtime-uta-no-oneesan-datte-shitai/m8182.html,Showtime!: Uta no Oneesan datte Shitai,,['hentai']
https://anime47.com/phim/engage-kiss/m8678.html,Engage Kiss,Engage Kiss,"['hài hước', 'harem', 'romance']"
https://anime47.com/phim/mushikaburi-hime/m8841.html,Mushikaburi-hime,Bibliophile Princess | 虫かぶり姫 | Princess of the Bibliophile.,"['drama', 'romance', 'lịch sử']"
https://anime47.com/phim/tru-tien/m8857.html,Tru Tiên,Tru Tiên,['hoạt hình trung quốc']
https://anime47.com/phim/long-toc/m8880.html,Long Tộc,Long Tộc,['hoạt hình trung quốc']
https://anime47.com/phim/vo-than-chua-te/m7828.html,Võ Thần Chúa Tể,Võ Thần Chúa Tể,"['phiêu lưu', 'phép thuật', 'hoạt hình trung quốc']"
https://anime47.com/phim/lieu-co-sai-lam-khi-tim-kiem-cuoc-gap-go-dinh-menh-trong-ham-nguc-iv-chuong-moi-phan-me-cung/m8669.html,Liệu Có Sai Lầm Khi Tìm Kiếm Cuộc Gặp Gỡ Định Mệnh Trong Hầm Ngục? IV: Chương Mới Phần Mê Cung,DanMachi 4th Season | Is It Wrong That I Want to Meet You in a Dungeon 4th Season | Dungeon ni Deai wo Motomeru no wa Machigatteiru Darou ka IV: Shin Shou - Meikyuu-hen,"['hành động', 'hài hước', 'phiêu lưu', 'romance', 'fantasy']"
https://anime47.com/phim/pokemon-full/m1612.html,Pokemon Full,Pokemon,"['hành động', 'hài hước', 'phiêu lưu', 'fantasy', 'kid']"
https://anime47.com/phim/detective-conan-tham-tu-lung-danh-conan-full/m7633.html,Detective Conan ( Thám Tử Lừng Danh Conan ) Full,Detective Conan ( Thám Tử Lừng Danh Conan ) Full,"['hài hước', 'phiêu lưu', 'shounen', 'mystery', 'police']"
https://anime47.com/phim/kantai-collection-itsuka-ano-umi-de/m8899.html,Kantai Collection  Itsuka Ano Umi de,Kantai Collection 1944,"['hành động', 'học đường', 'đời thường', 'viễn tưởng', 'military']"
https://anime47.com/phim/arifureta-shokugyou-de-sekai-saikyou-2nd-season/m7499.html,Arifureta Shokugyou de Sekai Saikyou 2nd Season,From Common Job Class to the Strongest in the World 2nd Season,"['hành động', 'phiêu lưu', 'harem', 'fantasy', 'xuyên không - chuyển kiếp']"
https://anime47.com/phim/cuoc-song-tai-di-gioi-cua-hien-gia-tai-sinh-toi-nhan-duoc-chuc-nghiep-thu-hai-va-da-tro-thanh-nguoi-manh-nhat-the-gioi/m8674.html,"Cuộc Sống Tại Dị Giới Của Hiền Giả Tái Sinh - Tôi Nhận Được Chức Nghiệp Thứ Hai, Và Đã Trở Thành Người Mạnh Nhất Thế Giới","Sekai Saikyou ni Narimashita | Tensei Kenja no Isekai Life: Dai-2 no Shokugyou wo Ete, Sekai Saikyou ni Narimashita","['hành động', 'phiêu lưu', 'fantasy', 'xuyên không - chuyển kiếp']"
https://anime47.com/phim/nho-ban-do-he-thong-chien-than/m8762.html,Nhờ Bạn Đó! Hệ Thống Chiến Thần,Nhờ Bạn Đó! Hệ Thống Chiến Thần,"['hành động', 'hài hước', 'siêu nhiên', 'hoạt hình trung quốc']"
https://anime47.com/phim/lianqi-lianle-3000-nian/m8883.html,Lianqi Lianle 3000 Nian,Luyện Khí 3000 Năm | I Have Refined Qi For 3000 Years! | 炼气练了3000年,"['hài hước', 'fantasy']"
https://anime47.com/phim/utawarerumono-futari-no-hakuoro/m8200.html,Utawarerumono: Futari no Hakuoro,Utawarerumono: Mask of Truth | Utwarerumono: Mặt Nạ Của Sự Thật,"['hành động', 'drama', 'viễn tưởng', 'fantasy']"
https://anime47.com/phim/nghich-thien-chi-ton/m8066.html,Nghịch Thiên Chí Tôn,Nghịch Thiên Chí Tôn,['hoạt hình trung quốc']
https://anime47.com/phim/than-an-vuong-toa/m8614.html,Thần Ấn Vương Tọa,Thần Ấn Vương Tọa,"['phiêu lưu', 'hoạt hình trung quốc']"
https://anime47.com/phim/kinsou-no-vermeil-gakeppuchi-majutsushi-wa-saikyou-no-yakusai-to-mahou-sekai-wo-tsukisusumu/m8677.html,Kinsou no Vermeil: Gakeppuchi Majutsushi wa Saikyou no Yakusai to Mahou Sekai wo Tsukisusumu,Kinsou no Vermeil: Gakeppuchi Majutsushi wa Saikyou no Yakusai to Mahou Sekai wo Tsukisusumu,"['phép thuật', 'học đường', 'fantasy']"
https://anime47.com/phim/tinh-vuc-bon-van-nam/m8875.html,Tinh Vực Bốn Vạn Năm,Tinh Vực Bốn Vạn Năm,['hoạt hình trung quốc']
https://anime47.com/phim/youkoso-jitsuryoku-shijou-shugi-no-kyoushitsu-e-tv-2nd-season/m8671.html,Youkoso Jitsuryoku Shijou Shugi no Kyoushitsu e (TV) 2nd Season,"Classroom of the Elite II, You-zitsu | Chào Mừng Đến Với Lớp Học Đề Cao Thực Lực 2","['hài hước', 'học đường', 'romance']"
https://anime47.com/phim/van-gioi-doc-ton/m7969.html,Vạn Giới Độc Tôn,Vạn Giới Độc Tôn,['hoạt hình trung quốc']
https://anime47.com/phim/kuro-no-shoukanshi/m8687.html,Kuro no Shoukanshi,Triệu Hồi Sư Áo Đen | Black Summoner | The Berserker Rises to Greatness.,"['hành động', 'fantasy']"
https://anime47.com/phim/linh-kiem-ton/m7826.html,Linh Kiếm Tôn,Linh Kiếm Tôn,"['phiêu lưu', 'phép thuật', 'hoạt hình trung quốc']"
https://anime47.com/phim/black-clover/m6408.html,Black Clover,Black Clover,"['hành động', 'hài hước', 'phép thuật', 'shounen', 'fantasy']"
https://anime47.com/phim/romantic-killer/m8894.html,Romantic Killer,ロマンティック・キラー | Romantic Killer,"['hài hước', 'romance', 'harem']"
https://anime47.com/phim/that-nghiep-chuyen-sinh-lam-lai-cuoc-doi-phan-2/m7967.html,Thất Nghiệp Chuyển Sinh: Làm Lại Cuộc Đời Phần 2,Mushoku Tensei: Isekai Ittara Honki Dasu 2nd Season,"['ecchi', 'drama', 'fantasy']"
https://anime47.com/phim/van-co-than-thoai/m8810.html,Vạn Cổ Thần Thoại,Vạn Cổ Thần Thoại,['hoạt hình trung quốc']
https://anime47.com/phim/fumetsu-no-anata-e/m7904.html,Fumetsu no Anata e,"Gửi em, người bất tử","['phiêu lưu', 'drama', 'siêu nhiên']"
https://anime47.com/phim/aika/m8893.html,AIKa,ＡＩＫａ | Agent AIKa | Agent AIKa,"['hành động', 'phiêu lưu', 'hài hước', 'viễn tưởng', 'ecchi']"
https://anime47.com/phim/jujutsu-kaisen-tv/m7676.html,Jujutsu Kaisen (TV),Sorcery Fight,"['hành động', 'kinh dị', 'học đường', 'shounen', 'siêu nhiên', 'demons']"
https://anime47.com/phim/naruto-phan-1/m1370.html,Naruto Phần 1,Naruto 1 | Naruto Dattebayo,"['hành động', 'hài hước', 'shounen', 'super power', 'martial arts']"
https://anime47.com/phim/jujutsu-kaisen-0-movie/m8806.html,Jujutsu Kaisen 0 Movie,Gekijouban Jujutsu Kaisen 0,"['hành động', 'kinh dị', 'học đường', 'shounen', 'siêu nhiên', 'demons']"
https://anime47.com/phim/hoshi-no-samidare/m8686.html,Hoshi no Samidare,Lucifer Và Chiếc Búa Bánh Quy | The Lucifer and Biscuit Hammer,"['hành động', 'hài hước', 'phiêu lưu', 'drama']"
https://anime47.com/phim/pham-nhan-tu-tien-phong-khoi-thien-nam/m7834.html,Phàm Nhân Tu Tiên - Phong Khởi Thiên Nam,Phàm Nhân Tu Tiên - Phong Khởi Thiên Nam,"['phiêu lưu', 'martial arts', 'hoạt hình trung quốc']"
https://anime47.com/phim/mamahaha-no-tsurego-ga-motokano-datta/m8673.html,Mamahaha no Tsurego ga Motokano datta,"My Stepsister is My Ex-Girlfriend, Tsurekano | Đứa Con Mà Mẹ Kế Dẫn Về Từng Là Bạn Gái Cũ","['hài hước', 'romance']"
https://anime47.com/phim/vo-thuong-than-de/m7833.html,Vô Thượng Thần Đế,Vô Thượng Thần Đế,"['phiêu lưu', 'phép thuật', 'martial arts', 'hoạt hình trung quốc']"
https://anime47.com/phim/summertime-render/m8317.html,Summertime Render,Summer Time Rendering,"['siêu nhiên', 'mystery']"
https://anime47.com/phim/doc-bo-tieu-dao/m7829.html,Độc Bộ Tiêu Dao,Độc Bộ Tiêu Dao,"['phiêu lưu', 'martial arts', 'hoạt hình trung quốc']"
https://anime47.com/phim/one-piece-movie-14-stampede/m7510.html,One Piece Movie 14: Stampede,ONE PIECE STAMPEDE ,"['hành động', 'hài hước', 'phiêu lưu', 'drama', 'shounen', 'fantasy', 'super power']"
https://anime47.com/phim/golden-kamuy-4th-season/m8833.html,Golden Kamuy 4th Season,ゴールデンカムイ | Golden Kamuy Season 4,"['hành động', 'phiêu lưu', 'lịch sử']"
https://anime47.com/phim/tate-no-yuusha-no-nariagari-season-2/m7877.html,Tate no Yuusha no Nariagari Season 2,Sự Trỗi Dậy của Khiên Anh Hùng 2,"['hành động', 'hài hước', 'phiêu lưu', 'drama', 'romance', 'fantasy', 'seinen']"
https://anime47.com/phim/van-gioi-tien-tung/m7824.html,Vạn Giới Tiên Tung,Vạn Giới Tiên Tung,"['phiêu lưu', 'phép thuật', 'hoạt hình trung quốc']"
https://anime47.com/phim/cuu-thien-huyen-de-quyet/m8134.html,Cửu Thiên Huyền Đế Quyết,Cửu Thiên Huyền Đế Quyết,"['hành động', 'martial arts', 'hoạt hình trung quốc']"
https://anime47.com/phim/lycoris-recoil/m8689.html,Lycoris Recoil,Lycoris Recoil,"['hành động', 'phiêu lưu', 'yuri']"
https://anime47.com/phim/ma-vuong-di-lam-mua-2/m8665.html,Ma Vương Đi Làm! Mùa 2,Hataraku Maou-sama!! | The Devil is a Part-Timer! Season 2,"['hài hước', 'romance', 'fantasy', 'siêu nhiên', 'demons', 'xuyên không - chuyển kiếp']"
https://anime47.com/phim/luoi-guom-diet-quy-phan-2-khu-ky-vien/m7860.html,Lưỡi Gươm Diệt Quỷ Phần 2 : Khu Kỹ Viện,Kimetsu no Yaiba: Yuukaku-hen,"['hành động', 'shounen', 'lịch sử', 'blu-ray', 'siêu nhiên', 'demons']"
https://anime47.com/phim/sword-art-online-progressive-movie-hoshi-naki-yoru-no-aria/m8750.html,Sword Art Online: Progressive Movie - Hoshi Naki Yoru no Aria,"SAO Progressive Movie, Aria in the Starless Night, Hoshinaki Yoru no Aria","['hành động', 'phiêu lưu', 'romance', 'blu-ray', 'fantasy', 'game']"
https://anime47.com/phim/kakkou-no-iinazuke/m8312.html,Kakkou no Iinazuke,Hôn thê cúc cu | Cặp Đôi Tu Hú,"['hài hước', 'romance']"
https://anime47.com/phim/4-nin-wa-sorezore-uso-wo-tsuku/m8822.html,4-nin wa Sorezore Uso wo Tsuku,Four People and Their Respective Lies,"['hài hước', 'đời thường']"
https://anime47.com/phim/meitantei-conan-hannin-no-hanzawa-san/m8890.html,Meitantei Conan: Hannin no Hanzawa-san,Detective Conan: Hannin no Hanzawa-san | Detective Conan: Hanzawa the Criminal | 名探偵コナン 犯人の犯沢さん | Detective Conan: The Culprit Hanazawa,"['hài hước', 'mystery']"
https://anime47.com/phim/ta-da-choc-tuc-ca-dam-tu-luyen-gia/m8131.html,Ta Đã Chọc Tức Cả Đám Tu Luyện Giả,Ta Đã Chọc Tức Cả Đám Tu Luyện Giả,"['hành động', 'phiêu lưu', 'phép thuật', 'hoạt hình trung quốc']"
https://anime47.com/phim/yofukashi-no-uta/m8670.html,Yofukashi no Uta,Yofukashi no Uta,"['romance', 'siêu nhiên']"
https://anime47.com/phim/tinh-linh-huyen-tuong-ky/m7746.html,Tinh Linh Huyễn Tưởng Ký,Seirei Gensouki - Spirit Chronicles,"['hành động', 'trinh thám', 'drama', 'harem', 'romance', 'fantasy', 'xuyên không - chuyển kiếp']"
https://anime47.com/phim/one-piece-film-gold/m5782.html,One Piece Film: Gold,One Piece Film: Gold,"['hành động', 'hài hước', 'phiêu lưu', 'drama', 'shounen', 'fantasy', 'super power']"
https://anime47.com/phim/bang-hoa-ma-tru/m8206.html,Băng Hỏa Ma Trù,Băng Hỏa Ma Trù,['hoạt hình trung quốc']
https://anime47.com/phim/one-piece-special-9-episode-of-sabo/m5186.html,One Piece Special 9 : Episode of Sabo,3 Kyoudai no Kizuna Kiseki no Saikai to Uketsugareru Ishi,"['hành động', 'hài hước', 'phiêu lưu', 'drama', 'shounen', 'fantasy', 'super power']"
https://anime47.com/phim/van-gioi-than-chu/m7848.html,Vạn Giới Thần Chủ,Vạn Giới Thần Chủ,['hoạt hình trung quốc']
https://anime47.com/phim/sword-art-online/m3504.html,Sword Art Online [BD],Sword Art Online [BD],"['hành động', 'phiêu lưu', 'romance', 'blu-ray', 'fantasy', 'game']"
https://anime47.com/phim/bastard-ankoku-no-hakaishin-ona/m8361.html,Bastard!! Ankoku no Hakaishin (ONA),Bastard!! Ankoku no Hakaishin (ONA),"['hành động', 'hài hước', 'ecchi', 'phiêu lưu', 'fantasy']"
https://anime47.com/phim/cuc-dao-long-than/m8771.html,Cực Đạo Long Thần,Cực Đạo Long Thần,"['phiêu lưu', 'hoạt hình trung quốc']"
https://anime47.com/phim/shijou-saikyou-no-daimaou-murabito-a-ni-tensei-suru/m8318.html,"Shijou Saikyou no Daimaou, Murabito A ni Tensei suru",The Greatest Maou is Reborned to Get Friends,"['hành động', 'fantasy']"
https://anime47.com/phim/arknights-reimei-zensou/m8845.html,Arknights: Reimei Zensou,Arknights: Prelude to Dawn | アークナイツ -黎明前奏- | Arknights Animation: Prelude to Dawn,"['hành động', 'fantasy']"
https://anime47.com/phim/yama-no-susume-next-summit/m8848.html,Yama no Susume: Next Summit,Encouragement of Climb: Next Summit | ヤマノススメ Next Summit,"['phiêu lưu', 'hài hước', 'đời thường', 'cgdct']"
https://anime47.com/phim/boku-no-hero-academia-5th-season/m7899.html,Boku no Hero Academia 5th Season,My Hero Academia 5,"['hành động', 'học đường', 'super power']"
https://anime47.com/phim/shinmai-maou-no-testament-burst-toujou-basara-no-shigoku-heiwa-na-nichijou/m7056.html,Shinmai Maou no Testament Burst: Toujou Basara no Shigoku Heiwa na Nichijou,Shinmai Maou no Testament Burst: Toujou Basara no Shigoku Heiwa na Nichijou,"['hành động', 'ecchi', 'harem', 'romance', 'fantasy', 'demons']"
https://anime47.com/phim/gintama-linh-hon-bac/m2443.html,Gintama - Linh Hồn Bạc,Gintama - Linh Hồn Bạc,"['hành động', 'hài hước', 'shounen', 'lịch sử', 'viễn tưởng', 'parody']"
https://anime47.com/phim/than-mo/m8773.html,Thần Mộ,Thần Mộ,"['xuyên không - chuyển kiếp', 'hoạt hình trung quốc']"
https://anime47.com/phim/tuyet-the-vo-hon/m7890.html,Tuyệt Thế Võ Hồn,"A Paragon of Wuhun, Jueshi Wuhun, 绝世武魂, Peerless Martial Spirit","['hành động', 'hoạt hình trung quốc']"
https://anime47.com/phim/one-piece-3d-straw-hat-chase/m4691.html,One Piece 3D: Straw Hat Chase,One Piece Movie 11 | One Piece 3D: Straw Hat Chase,"['hành động', 'hài hước', 'phiêu lưu', 'drama', 'shounen', 'fantasy', 'super power']"
https://anime47.com/phim/dragon-ball-super/m5098.html,Dragon Ball Super,Dragon Ball Chou,"['hành động', 'hài hước', 'phiêu lưu', 'shounen', 'fantasy', 'super power', 'martial arts']"
https://anime47.com/phim/isekai-ojisan/m8679.html,Isekai Ojisan,"Isekai Uncle, Ojisan in Another World, Uncle from Another World","['hài hước', 'fantasy', 'xuyên không - chuyển kiếp']"
https://anime47.com/phim/isekai-yakkyoku/m8684.html,Isekai Yakkyoku,Alternate World Pharmacy | Hiệu Thuốc Tại Dị Giới,"['fantasy', 'xuyên không - chuyển kiếp', 'y tế']"
https://anime47.com/phim/arifureta-shokugyou-de-sekai-saikyou/m7317.html,Arifureta Shokugyou de Sekai Saikyou,Arifureta: From Commonplace to World's Strongest,"['hành động', 'phiêu lưu', 'harem', 'fantasy', 'xuyên không - chuyển kiếp']"
https://anime47.com/phim/that-gioi-de-nhat-tien/m8280.html,Thất Giới Đệ Nhất Tiên,Thất Giới Đệ Nhất Tiên,"['fantasy', 'hoạt hình trung quốc']"
https://anime47.com/phim/mahouka-koukou-no-rettousei/m3990.html,Mahouka Koukou No Rettousei,Mahouka Koukou No Rettousei,"['hành động', 'phép thuật', 'học đường', 'romance', 'viễn tưởng', 'siêu nhiên']"
https://anime47.com/phim/trinity-seven-that-tinh/m4443.html,Trinity Seven - Thất Tinh [BD],Trinity Seven - Thất Tinh [Blu-ray],"['hành động', 'hài hước', 'ecchi', 'phép thuật', 'học đường', 'shounen', 'harem', 'romance', 'fantasy', 'siêu nhiên']"
https://anime47.com/phim/mahoutsukai-reimeiki/m8321.html,Mahoutsukai Reimeiki,Mahoutsukai Reimeiki,"['hành động', 'hài hước', 'phiêu lưu', 'fantasy']"
https://anime47.com/phim/fairy-tail/m4359.html,Fairy Tail,Hội Đuôi Tiên Phần 1 + 2,"['hành động', 'hài hước', 'phiêu lưu', 'phép thuật', 'shounen', 'fantasy']"
https://anime47.com/phim/vazzrock-the-animation/m8871.html,Vazzrock The Animation,VAZZROCK THE ANIMATION | Vazzrock the Animation,['âm nhạc']
https://anime47.com/phim/nguyet-dao-di-gioi/m8044.html,Nguyệt Đạo Dị Giới,Tsuki ga Michibiku Isekai Douchuu - Tsukimichi: Moonlit Fantasy ,"['phiêu lưu', 'fantasy', 'xuyên không - chuyển kiếp']"
